,Unnamed: 0,subreddit,title_with_selftext,title_with_selftext_cleaned,polarity,title_with_selftext_wo_link,new_title_with_selftext_cleaned,new_polarity,length,cleaned_length
318,341,depression,Shame Fuck shame. ,shame fuck shame  ,-0.4,Shame Fuck shame. ,shame fuck shame  ,-0.4,3,3
324,348,depression,Are you alone? I am so fucking alone.,alone  fucking alone ,-0.6,Are you alone? I am so fucking alone.,alone  fucking alone ,-0.6,8,3
1169,1246,depression,4:13 AM You fucking broke me.,fucking broke ,-0.6,4:13 AM You fucking broke me.,fucking broke ,-0.6,6,2
1262,1344,depression,A PSA on being tired all the time .,psa tired time  ,-0.4,A PSA on being tired all the time .,psa tired time  ,-0.4,9,3
2286,2433,depression,I am a failure at my only ambition What to do then?,failure ambition ,-0.3166666666666667,I am a failure at my only ambition What to do then?,failure ambition ,-0.3166666666666666,12,2
3515,3756,depression,Nobody gives a fuck. so why should I.,nobody give fuck  ,-0.4,Nobody gives a fuck. so why should I.,nobody give fuck  ,-0.4,8,3
3574,3820,depression,I'm soo lonely... And it hurts.,soo lonely    hurt ,-0.0999999999999999,I'm soo lonely... And it hurts.,soo lonely    hurt ,-0.0999999999999999,6,3
3747,4008,depression,being ugly makes me so depressed -,ugly make depressed  ,-0.7,being ugly makes me so depressed -,ugly make depressed  ,-0.7,7,3
4106,4388,depression,I am so pathetic  #,pathetic   ,-1.0,I am so pathetic  #,pathetic   ,-1.0,5,1
4618,4933,depression,Living in the past ... How to be more present..,living past     present  ,-0.125,Living in the past ... How to be more present..,living past     present  ,-0.125,10,3
5344,5702,depression,Breaking Sad https://medium.com/@AmandaRosenberg/breaking-sad-c969368f2869,breaking sad http   medium com  amandarosenberg breaking sad c969368f2869,-0.5,Breaking Sad ,breaking sad ,-0.5,2,2
5530,5902,depression,I Am Weird I ,weird ,-0.5,I Am Weird I ,weird ,-0.5,4,1
5580,5955,depression,Life is tough !!!!!!!! Yayyyyyyyyyyyyyyy /s ,life tough          yayyyyyyyyyyyyyyy  ,-0.3888888888888889,Life is tough !!!!!!!! Yayyyyyyyyyyyyyyy /s ,life tough          yayyyyyyyyyyyyyyy  ,-0.3888888888888889,6,3
5950,6346,depression,Whimsical communication http://waltherpragerandphilosophy.blogspot.com/2013/05/whimsical-communication.html,whimsical communication http   waltherpragerandphilosophy blogspot com whimsical communication html,-0.5,Whimsical communication ,whimsical communication ,-0.5,2,2
6627,7064,depression,How I feel...everyday. I'm so sick of this. ihttp://www.youtube.com/watch?v=mz4AqCY1ebw,feel   everyday  sick  ihttp   youtube com watch v mz4aqcy1ebw,-0.4571428571428572,How I feel...everyday. I'm so sick of this. i,feel   everyday  sick ,-0.4571428571428572,9,3
6737,7177,depression,Fuck high school. that is all.,fuck high school  ,-0.12,Fuck high school. that is all.,fuck high school  ,-0.12,6,3
8805,9362,depression,Nobody knows what's wrong with me. .,nobody know wrong   ,-0.5,Nobody knows what's wrong with me. .,nobody know wrong   ,-0.5,7,3
9625,10237,depression,I'm so worthless And I know it...,worthless know   ,-0.8,I'm so worthless And I know it...,worthless know   ,-0.8,7,2
9683,10300,depression,So tired of being alone ... Yeah ,tired alone     yeah ,-0.4,So tired of being alone ... Yeah ,tired alone     yeah ,-0.4,7,3
9697,10314,depression,talk for fucks sake,talk fuck sake,-0.4,talk for fucks sake,talk fuck sake,-0.4,4,3
9773,10393,depression,I feel pretty useless That is all.,feel pretty useless ,-0.125,I feel pretty useless That is all.,feel pretty useless ,-0.125,7,3
10261,10904,depression,Today was a bad day. .,today bad day   ,-0.6999999999999998,Today was a bad day. .,today bad day   ,-0.6999999999999998,6,3
10975,11665,depression,Fuck fuck,fuck fuck,-0.4,Fuck fuck,fuck fuck,-0.4,2,2
11105,11800,depression,This always kills me on the inside http://www.huffingtonpost.com/2012/09/25/pablo-stanley-gets-dark-w_n_1913942.html,always kill inside http   huffingtonpost com pablo stanley get dark w n html,-0.15,This always kills me on the inside ,always kill inside ,0.0,7,3
11247,11948,depression,Too late .,late  ,-0.3,Too late .,late  ,-0.3,3,1
11300,12006,depression,What does depression mean to you? .,depression mean   ,-0.3125,What does depression mean to you? .,depression mean   ,-0.3125,7,2
11343,12055,depression,I feel weird .,feel weird  ,-0.5,I feel weird .,feel weird  ,-0.5,4,2
12183,12956,depression,Today was a bad day. .,today bad day   ,-0.6999999999999998,Today was a bad day. .,today bad day   ,-0.6999999999999998,6,3
12425,13208,depression,FUCK IT...IM OUT...... Giving up...,fuck   im       giving   ,-0.4,FUCK IT...IM OUT...... Giving up...,fuck   im       giving   ,-0.4,5,3
12970,13784,depression,Mad World https://www.youtube.com/watch?v=Oa-ae6_okmg,mad world http   youtube com watch v oa ae6 okmg,-0.625,Mad World ,mad world ,-0.625,2,2
12984,13798,depression,my laugh is so fake i hate it,laugh fake hate,-0.3333333333333333,my laugh is so fake i hate it,laugh fake hate,-0.3333333333333333,8,3
13337,14176,depression,FUCK EVERYTHING FUCK  IT ALL!,fuck everything fuck  ,-0.4,FUCK EVERYTHING FUCK  IT ALL!,fuck everything fuck  ,-0.4,5,3
13639,14496,depression,Mad World https://www.youtube.com/watch?v=Oa-ae6_okmg,mad world http   youtube com watch v oa ae6 okmg,-0.625,Mad World ,mad world ,-0.625,2,2
13920,14790,depression,"My own little world ...
",little world    ,-0.1875,"My own little world ...
",little world    ,-0.1875,5,2
14204,15095,depression,Cutting and dreaming of suicide... *,cutting dreaming suicide     ,-0.6,Cutting and dreaming of suicide... *,cutting dreaming suicide     ,-0.6,6,3
14692,15614,depression,I hate life. That is all. ,hate life   ,-0.8,I hate life. That is all. ,hate life   ,-0.8,6,2
14836,15764,depression,The person who hates me the most is myself How to live then?,person hate live ,-0.3318181818181818,The person who hates me the most is myself How to live then?,person hate live ,-0.3318181818181818,13,3
15005,15944,depression,Your a slave and then you die And there ain't shit you can do about it. ,slave die shit  ,-0.2,Your a slave and then you die And there ain't shit you can do about it. ,slave die shit  ,-0.2,16,3
15165,16114,depression,Everyone hates me ........,everyone hate         ,-0.8,Everyone hates me ........,everyone hate         ,-0.8,4,2
15700,16686,depression,Sorry Just. Sorry. ,sorry  sorry  ,-0.5,Sorry Just. Sorry. ,sorry  sorry  ,-0.5,3,2
15933,16933,depression,Fuck depression! We matter! https://www.youtube.com/watch?v=2QPLW9ItP2U,fuck depression  matter  http   youtube com watch v 2qplw9itp2u,-0.4,Fuck depression! We matter! ,fuck depression  matter  ,-0.4,4,3
16204,17220,depression,"Depression Parkour We've been through this at least once...

http://threewordphrase.com/parkour.htm

",depression parkour least   http   threewordphrase com parkour htm,-0.3,"Depression Parkour We've been through this at least once...



",depression parkour least   ,-0.3,9,3
16373,17401,depression,I feel pretty useless That is all.,feel pretty useless ,-0.125,I feel pretty useless That is all.,feel pretty useless ,-0.125,7,3
17871,18987,depression,Any porn addicts on here? Just curious. ,porn addict  curious  ,-0.1,Any porn addicts on here? Just curious. ,porn addict  curious  ,-0.1,7,3
18216,19355,depression,"The Power of Negative Thinking http://online.wsj.com/article/SB10001424127887324705104578147333270637790.html
",power negative thinking http   online wsj com article sb10001424127887324705104578147333270637790 html,-0.3,"The Power of Negative Thinking 
",power negative thinking ,-0.3,5,3
18385,19534,depression,my lockheart is broken... help..,lockheart broken    help  ,-0.4,my lockheart is broken... help..,lockheart broken    help  ,-0.4,5,3
18635,19803,depression,How fucked am I? ...,fucked     ,-0.6,How fucked am I? ...,fucked     ,-0.6,5,1
19275,20486,depression,"I'm exhausted, miserable I'm a loser.",exhausted  miserable loser ,-0.7,"I'm exhausted, miserable I'm a loser.",exhausted  miserable loser ,-0.7,6,3
19548,20775,depression,Whimsical communication http://waltherpragerandphilosophy.blogspot.com/2013/05/whimsical-communication.html,whimsical communication http   waltherpragerandphilosophy blogspot com whimsical communication html,-0.5,Whimsical communication ,whimsical communication ,-0.5,2,2
19855,21096,depression,I'm so worthless And I know it...,worthless know   ,-0.8,I'm so worthless And I know it...,worthless know   ,-0.8,7,2
20856,22141,depression,Suicide: a solution to failures? http://waltherpragerandphilosophy.blogspot.com/2013/02/infinite-endurance.html,suicide  solution failure  http   waltherpragerandphilosophy blogspot com infinite endurance html,-0.3166666666666667,Suicide: a solution to failures? ,suicide  solution failure  ,-0.3166666666666666,5,3
21223,22540,depression,Any porn addicts on here? Just curious. ,porn addict  curious  ,-0.1,Any porn addicts on here? Just curious. ,porn addict  curious  ,-0.1,7,3
21320,22641,depression,UUUGGGGGGGGHHHHHH FUCK,uuugggggggghhhhhh fuck,-0.4,UUUGGGGGGGGHHHHHH FUCK,uuugggggggghhhhhh fuck,-0.4,2,2
21478,22807,depression,Lazy and/or depressed http://cdn.memegenerator.net/instances/400x/29731812.jpg,lazy depressed http   cdn memegenerator net instance 400x jpg,-0.125,Lazy and/or depressed ,lazy depressed ,-0.25,3,2
22818,24220,depression,fuck. it's 1:53 am and it's back. fuck. ,fuck  back  fuck  ,-0.2666666666666666,fuck. it's 1:53 am and it's back. fuck. ,fuck  back  fuck  ,-0.2666666666666666,8,3
22884,24290,depression,Mostly confused right now .,mostly confused right  ,-0.0571428571428571,Mostly confused right now .,mostly confused right  ,-0.0571428571428571,5,3
23702,25150,depression,talk for fucks sake,talk fuck sake,-0.4,talk for fucks sake,talk fuck sake,-0.4,4,3
24336,25818,depression,UUUGGGGGGGGHHHHHH FUCK,uuugggggggghhhhhh fuck,-0.4,UUUGGGGGGGGHHHHHH FUCK,uuugggggggghhhhhh fuck,-0.4,2,2
24738,26248,depression,Not to be a Negative Nancy k,negative nancy k,-0.3,Not to be a Negative Nancy k,negative nancy k,-0.3,7,3
24857,26374,depression,My sad life -,sad life  ,-0.5,My sad life -,sad life  ,-0.5,4,2
25039,26570,depression,FUCK #FUUUUUUUUUUUUCK ,fuck  fuuuuuuuuuuuuck ,-0.4,FUCK #FUUUUUUUUUUUUCK ,fuck  fuuuuuuuuuuuuck ,-0.4,2,2
25198,26736,depression,I feel weird .,feel weird  ,-0.5,I feel weird .,feel weird  ,-0.5,4,2
25701,27271,depression,I ran out of liquor fuck,ran liquor fuck,-0.4,I ran out of liquor fuck,ran liquor fuck,-0.4,6,3
28784,30553,depression,Sick of pretending .,sick pretending  ,-0.7142857142857143,Sick of pretending .,sick pretending  ,-0.7142857142857143,4,2
30404,32290,depression,I'm a mess -,mess  ,-0.175,I'm a mess -,mess  ,-0.175,4,1
30496,32389,depression,Fuck life I'm done.,fuck life done ,-0.4,Fuck life I'm done.,fuck life done ,-0.4,4,3
30857,32772,depression,fuck its back,fuck back,-0.2,fuck its back,fuck back,-0.2,3,2
30877,32794,depression,Fuck life  I hate who I am. ,fuck life  hate  ,-0.6000000000000001,Fuck life  I hate who I am. ,fuck life  hate  ,-0.6000000000000001,7,3
30927,32846,depression,Dealing with some crazy shit... .,dealing crazy shit     ,-0.4,Dealing with some crazy shit... .,dealing crazy shit     ,-0.4,6,3
32594,34606,depression,I almost killed myself today. That's all.,almost killed today  ,-0.2,I almost killed myself today. That's all.,almost killed today  ,-0.2,7,3
32611,34629,depression,"i am so lonely, all the time that's all.",lonely  time ,-0.0999999999999999,"i am so lonely, all the time that's all.",lonely  time ,-0.0999999999999999,9,2
33313,35362,depression,Always exhausted and crying .,always exhausted cry  ,-0.4,Always exhausted and crying .,always exhausted cry  ,-0.4,5,3
33337,35390,depression,Fuck this fucking shit Over it all,fuck fucking shit,-0.3,Fuck this fucking shit Over it all,fuck fucking shit,-0.3,7,3
34200,36302,depression,I almost killed myself today. That's all.,almost killed today  ,-0.2,I almost killed myself today. That's all.,almost killed today  ,-0.2,7,3
